,2007,2006,2005
basic net income available for common shareholders,$ 217692,$ 145095,$ 309183
minority interest in earnings of common unitholders,14399,14238,29649
diluted net income available for common shareholders,$ 232091,$ 159333,$ 338832
weighted average number of common shares outstanding,139255,134883,141508
weighted average partnership units outstanding,9204,13186,13551
dilutive shares for stock-based compensation plans ( 1 ),1155,1324,818
weighted average number of common shares and potential dilutive common equivalents,149614,149393,155877
